Alder Flycatcher (Empidonax alnorum),,,,,,,,,,,,,,,,,
American Crow (Corvus brachyrhynchos) ,1,1,,,2,,,,,,1,,1,2,1,,
American Goldfinch (Carduelis tristis) ,,,,,1,,1,,,1,,,1,1,,,1
American Kestrel (Falco sparverius),,,,,,,,,,,,,,,,,
American Redstart (Setophaga ruticilla) ,,,,,,,,,,,,,,,,1,1
American Robin (Turdus migratorius) ,1,1,1,,1,1,1,1,,,,,,,,,1
American White Pelican (Pelecanus erythrorhynchos),,,,,,,,,,,,,,,,,
Bald Eagle (Haliaeetus leucocephalus),,,,,,,,,,,,,,,,,
Baltimore oriole (Icterus galbula) ,1,1,1,,,,,,,,,,,,,,
Barn Swallow (Hirundo rustica) ,,,,1,1,,,,,,,,,,,,
Bay-breasted Warbler (Dendroica castanea),,,,,,,,,,,,,,,,,
Belted Kingfisher (Ceryle alcyon) ,,,,,,,,,,,,,,,,,
Black Tern (Chlidonias niger),,,,,,,,,,,,,,,,,
Black-and-white Warbler (Mniotilta varia),,,,,,,,,,,,,,,,,
Blackburnian Warbler (Dendroica fusca) ,,,,,,,,,,,,,,,,,
Black-capped Chickadee (Parus atricapillus) ,2,2,2,3,,,,,1,2,1,1,1,,1,1,1
Blackpoll Warbler (Dendroica striata) ,,,,,,,,,,,,,,,,,
Black-throated Green Warbler (Dendroica virens) ,,,,,,,,,,,,,,,,,
Blue Jay (Cyanocitta cristata) ,,,,,2,,,,,1,1,,1,2,1,,1
Blue-gray Gnatcatcher (Polioptila caerula) ,,,,,,,,,,,,,,,,,
Blue-headed [solitary] Vireo (Vireo solitarius) ,,,,,,,,,,,,,,,,,
Blue-winged Teal (Anas discors),,,,,,,,,,,,,,,,,
Blue-winged Warbler (Vermivora pinus),,,,,,,,,,,,,,,,,
Bobolink (Dolichonyx oryzivorus),,,,,,,,,,,,,,,,,
Broad-winged Hawk (Buteo playpterus),,,,,,,,,,,,,,,,,
Brown Thrasher (Toxostoma rufum),,,,,,,,,,,,,,,,,
Brown-headed Cowbird (Molothrus ater) ,,,,1,,1,1,,,,,,,,,,1
Canada Goose (Branta canadensis),1,2,2,2,,1,1,,,1,2,,,,,,
Canada Warbler (Wilsonia canadensis) ,,,,,,,,,,,,,,,,,
Cape May Warbler (Dendroica tigrina),,,,,,,,,,,,,,,,,
Caspian tern (Hydroprogne caspia = Sterna caspia),,,,,,,,,,,,,,,,,
Cedar Waxwing (Bombycilla cedrorum) ,,,,,,,,,,,,,,,,,
Chestnut-sided Warbler (Dendroica pensylvanica) ,,,,,,,,,,,,,,,,,
Chimney Swift (Chaetura pelagica),,,,,,,,,,,,,,,,,
Chipping Sparrow (Spizella passerina) ,,,,,,,,,,,,,,,,,
Clay-colored Sparrow (Spizella pallida),,,,1,2,1,1,,,1,,,1,,1,,
Cliff Swallow (Petrochelidon pyrrhonota),,,,,,,,,,,,,,,,,
Common Grackle (Quiscalus quiscula) ,,,,,,,,,,,,,,4,,,
Common Yellowthroat (Geothlypis trichas) ,1,,,3,1,1,2,1,,,,,1,2,2,,
Connecticut Warbler (Oporornis agilis),,,,,,,,,,,,,,,,,
Cooper's Hawk (Accipiter cooperii),,,,,,,,,,,,,,,,,
Downy Woodpecker (Picoides pubescens),,,,,,,,,,,,,,1,,,
Eastern Bluebird (Sialia sialis) ,,,1,,,,,,,,,,,,,,
Eastern Kingbird (Tyrannus tyrannus) ,,,,,,,,,,,,,,,,,
Eastern Meadowlark (Sturnella magna),,,,,,,,,,,,,,,,,
Eastern Phoebe (Sayornis phoebe),,,,,,,,,,,,,,,,,
Eastern Towhee (Pipilo erythrophthalmus),,,,,,,,,,,,,,,,,
Eastern Wood-pewee (Contopus virens),,,,,,,,,,,,,,,,,
European Starling (Sturnus vulgaris) ,,,,,,,,,,,,,,,,,
Evening Grosbeak (Coccothraustes vespertinus),,,,,,,,,,,,,,,,,
Field Sparrow (Spizella pusilla) ,,1,2,2,2,2,1,1,2,1,1,,1,2,1,,1
Golden Eagle (Aquila chrysaetos),,,,,,,,,,,,,,,,,
Golden-winged Warbler (Vermivora chrysoptera),,,,,,,,,,,,,,,,,
Grasshopper Sparrow (Ammodramus savannarum),,,,,,,,,,,,,,,,,
Gray Catbird (Dumetella caroliniensis) ,,,,,,,1,,,1,,,,,,,
Gray-cheeked Thrush (Catharus minimus),,,,,,,,,,,,,,,,,
Great Blue Heron (Ardea herodius),,,,,,,,,,,,,,,,,
Great Crested Flycatcher (Myiarchus crinitus) ,,,,,,,,,,,,,,,,,
Great Egret (Ardea alba),,,,,,,,,,,,,,,,,
Great Horned Owl (Bubo virginianus),,,,,,,,,,,,,,,,,
Green Heron (Butorides virescens),,,,,,,,,,,,,,,,,
Hairy Woodpecker (Picoides villosus),,,,,,,,,,,,,,,,,
Henslow's Sparrow (Ammodramus henslowii),,,,1,1,1,,,,,,,,,,,
Hermit Thrush (Catharus guttatus),,,,,,,,,,,,,,,,,
House Finch (Carpodacus mexicanus),,,,,,,,,,,,,,,,,
House Sparrow (Passer domesticus),,,,,,,,,,,,,,,,,
House Wren (Troglodytes aedon) ,1,2,1,,,,,1,1,2,,,2,1,,1,1
Indigo Bunting (Passerina cyanea) ,,,,,,,,,,,,,,,,,
Killdeer (Charadrius vociferus),,,,,,,,,,,,,,,,,
Least Flycatcher (Empidonax minimus),,,,,,,,,,,,,,,,,
Magnolia Warbler (Dendroica magnolia),,,,,,,,,,,,,,,,,
Mallard (Anas platyrhynchos),,,,,,,,,,,,,,,,,
Marsh Wren (Cistothorus palustris),,,,,,,,,,,,,,,,,
Mourning Dove (Zenaida macroura) ,,,,,,,,,,,,,1,,,,
Mourning Warbler (Oporornis philadelphia),,,,,,,,,,,,,,,,,
Nashville Warbler (Vermivora ruficapilla) ,,,,,,,,,,,,,,,,,
Northern Cardinal (Cardinalis cardinalis) ,1,,3,1,,,,1,1,,1,,,2,1,1,1
Northern Flicker (Colaptes auratus),,,,,,,,,,,,,,,,,
Northern Harrier (Circus cyaneus),,,,,,,,,,,,,,,,,
Northern Parula (Parula americana),,,,,,,,,,,,,,,,,
Northern Rough-winged Swallow (Stelgidopteryx serripennis),,,,,,,,,,,,,,,,,
Northern Waterthrush (Seirus noveboracensis),,,,,,,,,,,,,,,,,
Olive-sided Flycatcher (Contopus cooperi),,,,,,,,,,,,,,,,,
Orange-crowned Warbler (Vermivora celata),,,,,,,,,,,,,,,,,
Orchard oriole (Icterus spurius),,,,,,,,,,,,,,,,,
Osprey (Pandion haliaetus),,,,,,,,,,,,,,,,,
Ovenbird (Seirus aurocapillus) ,,,,,,,,,,,,1,,,,,
Palm Warbler (Dendroica palmarum),,,,,,,,,,,,,,,1,,
Peregrine Falcon (Falco peregrinus),,,,,,,,,,,,,,,,,
Philadelphia Vireo (Vireo philadelphicus),,,,,,,,,,,,,,,,,
Pileated Woodpecker (Dryocopus pileatus) ,,,,,,,,,,,,,,,,,
Red-bellied Woodpecker (Melanerpes carolinus),1,,,,,,1,,,,,,,,,,
Red-eyed Vireo (Vireo olivaceus) ,,,,,,,,,,,,,,,,,
Red-headed Woodpecker (Melanerpes erythrocephalus) ,,,,,,,,,,,,,,,,,
Red-Tailed Hawk (Buteo jamaicensis),,,,,,,,,,,,,,,,,
Red-winged Blackbird (Agelaius tricolor) ,2,1,1,,,2,10,3,,,,,,,,,1
Ring-billed Gull (Larus delawarensis),,,,,,,,,,,,,,,,,
Ring-necked Pheasant (Phasianus colchicus),,1,,,1,1,1,1,,1,,,,,,,
Rock Pigeon (Columba livia),,,,,,,,,,,,,,,,,
Rose-breasted Grosbeak (Pheucticus ludovicianus) ,,,,,,1,,,,,,,,,,1,
Ruby-crowned Kinglet (Regulus calendula),,,,,,,,,,,,,,,,,
Ruby-Throated Hummingbird (Archilocus colubris),,,,,,,,,,,,,,,,,
Sandhill Crane (Grus canadensis),,,,,,,,,,,,,,,,,
Savannah Sparrow (Passerculus sandwichensis),,,,,,,,,,,,,,,,,
Scarlet Tanager (Piranga olivacea) ,,,,,,,,,,,,,,,,,
Sedge Wren (Cistothorus platensis),,,,,,,,,,,,,,,,,
Solitary Sandpiper (Tringa solitaria),,,,,,,,,,,,,,,,,
Song Sparrow (Melospiza melodia) ,1,1,1,1,1,2,1,1,1,,,,3,,1,1,1
Sora (Porzana carolina),,,,,,,,,,,,,,,,,
Spotted Sandpiper (Actitis macularia),,,,,,,,,,,,,,,,,
Swainson’s Thrush (Catharus ustulatus) ,,,,,,,,,,,,,,,,,
Swamp Sparrow (Melospiza georgiana),,,,,,,,,,,,,,,,,
Tennesee Warbler (Vermivora peregrina) ,,,,,,,,,,,,,,,,,
Tree Swallow (Tachycineta bicolor) ,,,,,1,,,,,,,,,,,,
Tufted Titmouse (Baeolophus bicolor),,,,,,,,,,,,,,,,,
Turkey Vulture (Cathartes aura),,,,,,,,,,,,,1,,2,,
Veery (Catharus fuscescens) ,,,,,,,,,,,,,,,,,
Vesper Sparrow (Pooecetes gramineus),,,,,,,,,,,,,,,,,
Warbling Vireo (Vireo gilvus) ,,,,,,,,,,,,,,,,,
White-breasted Nuthatch (Sitta carolinensis) ,,,,,,,,1,,,1,,1,,,2,
White-Crowned Sparrow (Zonotrichia leucophrys),,,,,,,,,,,,,,,,,
White-throated Sparrow (Zonotrichia albicollis),,,,,,,,,,,,,,,,,
Wild Turkey (Meleagris gallopavo),,,,,,,,,,,,,,,,,
Willow Flycatcher (Empidonax traillii),,,,,,,,,,,,,,,,,
Wilson's Warbler (Wilsonia pusilla) ,,,,,,,,,,,,,,,,,
Wood Duck (Aix sponsa),,,,,,,,,,,,,,,,,
Wood Thrush (Hylocichla mustelina) ,,,,,,,,,,,,,,,1,1,
Yellow Warbler (Dendroica petechia) ,,,,,,,,,,,1,,,,,,
Yellow-bellied Flycatcher (Empidonax flaviventris) ,,,,,,,,,,,,,,,,,
Yellow-bellied Sapsucker (Sphyrapicus varius),,,,,,,,,,,,,,,,,
Yellow-headed Blackbird (Xanthocephalus xanthocephalus),,,,,,,,,,,,,,,,,
Yellow-rumped Warbler (Dendroica coronata),,,,,,,,,,,,,,,,,
Yellow-throated Vireo (Vireo flavifrons) ,,,,,,,,,,,,,,,,1,
